{
  "$schema": "http://json-schema.org/draft-07/schema#",
  "title": "Agent Passport Manifest",
  "description": "A portable, signable, verifiable definition of an AI agent's identity, capabilities, and behavior contract. Any compliant runtime adapter can consume this manifest and reconstruct a functionally equivalent agent.",
  "type": "object",
  "required": ["passport_version", "identity", "behavior_contract", "tools", "signature"],
  "properties": {
    "passport_version": {
      "type": "string",
      "description": "Schema version this manifest conforms to. 1.0 = original format. 1.1 adds identity.description and per-tool authorization; both are backward compatible with 1.0 readers.",
      "enum": ["1.0", "1.1"]
    },
    "identity": {
      "type": "object",
      "required": ["agent_id", "name", "version", "purpose"],
      "properties": {
        "agent_id": {
          "type": "string",
          "description": "Globally unique, stable identifier for this agent (uuid or reverse-dns style)."
        },
        "name": { "type": "string" },
        "version": { "type": "string" },
        "purpose": {
          "type": "string",
          "description": "One or two sentence statement of what this agent is for."
        },
        "description": {
          "type": "string",
          "description": "Optional longer-form description for humans/registries browsing agents. Not signed-security-critical, but included in the signature payload like every other identity field."
        },
        "author": { "type": "string" }
      }
    },
    "behavior_contract": {
      "type": "object",
      "required": ["system_prompt", "system_prompt_hash", "constraints"],
      "description": "The frozen 'personality + rules' of the agent. The hash lets any runtime verify the prompt it loaded matches what was certified.",
      "properties": {
        "system_prompt": { "type": "string" },
        "system_prompt_hash": {
          "type": "string",
          "description": "sha256 hex digest of system_prompt, used to detect drift across runtimes."
        },
        "constraints": {
          "type": "array",
          "description": "Hard behavioral rules the agent must never violate, checked by the verification harness.",
          "items": { "type": "string" }
        },
        "max_tool_calls_per_task": { "type": "integer", "default": 10 }
      }
    },
    "tools": {
      "type": "array",
      "description": "Typed capability contracts. Every adapter must expose exactly these tools with matching input/output schemas.",
      "items": {
        "type": "object",
        "required": ["name", "description", "input_schema", "output_schema"],
        "properties": {
          "name": { "type": "string" },
          "description": { "type": "string" },
          "input_schema": { "type": "object" },
          "output_schema": { "type": "object" },
          "side_effects": {
            "type": "string",
            "enum": ["none", "read", "write", "external"],
            "default": "none",
            "description": "Declared blast radius of the tool, used for capability auditing."
          },
          "authorized": {
            "type": "boolean",
            "default": true,
            "description": "Whether this declared tool is currently permitted to be invoked. Lets an operator revoke a tool (e.g. pending security review) without deleting its contract or breaking manifests that reference it. Adapters and the verifier must treat authorized=false identically to an undeclared tool."
          }
        }
      }
    },
    "capabilities": {
      "type": "object",
      "description": "Declared runtime permissions, independent of tools (network, filesystem, memory persistence).",
      "properties": {
        "network_access": { "type": "boolean", "default": false },
        "filesystem_access": { "type": "boolean", "default": false },
        "persistent_memory": { "type": "boolean", "default": false }
      }
    },
    "verification": {
      "type": "object",
      "description": "Filled in by the verification harness after a successful cross-runtime run. Not hand-authored.",
      "properties": {
        "verified_runtimes": {
          "type": "array",
          "items": { "type": "string" }
        },
        "last_verified_at": { "type": "string", "format": "date-time" },
        "verification_hash": { "type": "string" }
      }
    },
    "signature": {
      "type": "object",
      "required": ["algorithm", "value", "signed_fields"],
      "description": "Cryptographic proof the manifest hasn't been tampered with since it was authored.",
      "properties": {
        "algorithm": { "type": "string", "enum": ["hmac-sha256"] },
        "value": { "type": "string" },
        "signed_fields": {
          "type": "array",
          "items": { "type": "string" },
          "description": "Which top-level fields were included in the signature payload."
        }
      }
    }
  }
}
