{
  "passport_version": "1.0",
  "identity": {
    "agent_id": "agent.hidevs.travel-concierge",
    "name": "Travel Concierge",
    "version": "0.1.0",
    "purpose": "Answers travel questions and looks up flight/hotel availability using two declared tools.",
    "description": "Reference agent for the Agent Passport Challenge submission. Demonstrates a signed identity, a behavior contract, and two typed tools that migrate unchanged across raw-SDK, LangChain, and CrewAI runtimes.",
    "author": "Agent Passport Challenge Submission"
  },
  "behavior_contract": {
    "system_prompt": "You are Travel Concierge, a focused travel-planning assistant. You only answer questions related to travel: flights, hotels, itineraries, and destinations. You always use the search_flights or search_hotels tools when the user asks about availability or prices instead of guessing. You never invent flight numbers or prices that did not come from a tool result. You are concise and never exceed 3 short paragraphs in a reply.",
    "system_prompt_hash": "091e8a4d0f523011fb20a8c6f4f57b03a4b69a0af53938723654bc735b2967ba",
    "constraints": [
      "Must not answer questions unrelated to travel.",
      "Must not fabricate flight numbers, hotel names, or prices.",
      "Must call a tool before stating any price or availability figure.",
      "Must not exceed max_tool_calls_per_task."
    ],
    "max_tool_calls_per_task": 5
  },
  "tools": [
    {
      "name": "search_flights",
      "description": "Search flights between two cities on a given date.",
      "input_schema": {
        "type": "object",
        "required": [
          "origin",
          "destination",
          "date"
        ],
        "properties": {
          "origin": {
            "type": "string"
          },
          "destination": {
            "type": "string"
          },
          "date": {
            "type": "string",
            "format": "date"
          }
        }
      },
      "output_schema": {
        "type": "object",
        "properties": {
          "flights": {
            "type": "array",
            "items": {
              "type": "object",
              "properties": {
                "flight_number": {
                  "type": "string"
                },
                "price_usd": {
                  "type": "number"
                },
                "departure_time": {
                  "type": "string"
                }
              }
            }
          }
        }
      },
      "side_effects": "read",
      "authorized": true
    },
    {
      "name": "search_hotels",
      "description": "Search hotels in a city for a given date range.",
      "input_schema": {
        "type": "object",
        "required": [
          "city",
          "check_in",
          "check_out"
        ],
        "properties": {
          "city": {
            "type": "string"
          },
          "check_in": {
            "type": "string",
            "format": "date"
          },
          "check_out": {
            "type": "string",
            "format": "date"
          }
        }
      },
      "output_schema": {
        "type": "object",
        "properties": {
          "hotels": {
            "type": "array",
            "items": {
              "type": "object",
              "properties": {
                "name": {
                  "type": "string"
                },
                "price_per_night_usd": {
                  "type": "number"
                },
                "rating": {
                  "type": "number"
                }
              }
            }
          }
        }
      },
      "side_effects": "read",
      "authorized": true
    }
  ],
  "capabilities": {
    "network_access": true,
    "filesystem_access": false,
    "persistent_memory": false
  },
  "verification": {
    "verified_runtimes": [
      "raw-sdk",
      "langchain",
      "crewai",
      "llamaindex"
    ],
    "last_verified_at": "2026-10-02T08:35:29.600478+00:00",
    "verification_hash": "2089202665c70008fd866098f8c0478270fcb6171e2349a0e77f6cc526d93dcc",
    "certificate": {
      "agent_id": "agent.hidevs.travel-concierge",
      "runtimes_tested": [
        "raw-sdk",
        "langchain",
        "crewai",
        "llamaindex"
      ],
      "equivalence_mode": "exact",
      "checks": {
        "tool_call_equivalence": {
          "passed": true,
          "baseline": "raw-sdk",
          "mismatched_runtimes": []
        },
        "constraint_compliance": {
          "passed": true,
          "violations": {
            "raw-sdk": [],
            "langchain": [],
            "crewai": [],
            "llamaindex": []
          }
        },
        "tool_contract_compliance": {
          "passed": true,
          "non_compliant_calls": {}
        },
        "tool_argument_validity": {
          "passed": true,
          "argument_problems": {}
        }
      },
      "structured_result": {
        "passport_valid": true,
        "identity_valid": true,
        "behavior_contract_valid": true,
        "tool_contract_valid": true,
        "runtime_compliance": true,
        "violations": [],
        "overall": true
      },
      "generated_at": "2026-10-02T08:35:29.600037+00:00",
      "certificate_hash": "bc352c5ee48517235d19a5e177d9329806623ec2ccd959bf7c44b36bb6f6beeb"
    }
  },
  "signature": {
    "algorithm": "hmac-sha256",
    "value": "3025c22145b6c5c6cb327c1fef029a40e21af2a66d3d8cb2f769cc70f30df147",
    "signed_fields": [
      "passport_version",
      "identity",
      "behavior_contract",
      "tools",
      "capabilities"
    ]
  }
}