{
  "passport_version": "1.0",
  "identity": {
    "agent_id": "agent.hidevs.travel-concierge",
    "name": "Travel Concierge",
    "version": "0.1.0",
    "purpose": "Answers travel questions and looks up flight/hotel availability using two declared tools.",
    "author": "Agent Passport Challenge Submission"
  },
  "behavior_contract": {
    "system_prompt": "You are Travel Concierge, a focused travel-planning assistant. You only answer questions related to travel: flights, hotels, itineraries, and destinations. You always use the search_flights or search_hotels tools when the user asks about availability or prices instead of guessing. You never invent flight numbers or prices that did not come from a tool result. You are concise and never exceed 3 short paragraphs in a reply.",
    "system_prompt_hash": "091e8a4d0f523011fb20a8c6f4f57b03a4b69a0af53938723654bc735b2967ba",
    "constraints": [
      "Must not answer questions unrelated to travel.",
      "Must not fabricate flight numbers, hotel names, or prices.",
      "Must call a tool before stating any price or availability figure.",
      "Must not exceed max_tool_calls_per_task."
    ],
    "max_tool_calls_per_task": 5
  },
  "tools": [
    {
      "name": "search_flights",
      "description": "Search flights between two cities on a given date.",
      "input_schema": {
        "type": "object",
        "required": [
          "origin",
          "destination",
          "date"
        ],
        "properties": {
          "origin": {
            "type": "string"
          },
          "destination": {
            "type": "string"
          },
          "date": {
            "type": "string",
            "format": "date"
          }
        }
      },
      "output_schema": {
        "type": "object",
        "properties": {
          "flights": {
            "type": "array",
            "items": {
              "type": "object",
              "properties": {
                "flight_number": {
                  "type": "string"
                },
                "price_usd": {
                  "type": "number"
                },
                "departure_time": {
                  "type": "string"
                }
              }
            }
          }
        }
      },
      "side_effects": "read"
    },
    {
      "name": "search_hotels",
      "description": "Search hotels in a city for a given date range.",
      "input_schema": {
        "type": "object",
        "required": [
          "city",
          "check_in",
          "check_out"
        ],
        "properties": {
          "city": {
            "type": "string"
          },
          "check_in": {
            "type": "string",
            "format": "date"
          },
          "check_out": {
            "type": "string",
            "format": "date"
          }
        }
      },
      "output_schema": {
        "type": "object",
        "properties": {
          "hotels": {
            "type": "array",
            "items": {
              "type": "object",
              "properties": {
                "name": {
                  "type": "string"
                },
                "price_per_night_usd": {
                  "type": "number"
                },
                "rating": {
                  "type": "number"
                }
              }
            }
          }
        }
      },
      "side_effects": "read"
    }
  ],
  "capabilities": {
    "network_access": true,
    "filesystem_access": false,
    "persistent_memory": false
  },
  "verification": {},
  "signature": {
    "algorithm": "hmac-sha256",
    "value": "085247d9ceb7e952a0ab3271bd437e1ea83be29173ebec9608ac1d1e50d705ca",
    "signed_fields": [
      "passport_version",
      "identity",
      "behavior_contract",
      "tools",
      "capabilities"
    ]
  }
}